{
  "$schema": "https://json-schema.org/draft/2020-12/schema",
  "$id": "https://openantigeo.org/schemas/proposal.schema.json",
  "title": "AntiGEO Proposal",
  "description": "Schema for an AntiGEO proposal record used to submit, review, and decide governance actions related to entities, statuses, and associated records.",
  "type": "object",
  "additionalProperties": false,
  "properties": {
    "id": {
      "type": "string",
      "description": "Stable unique identifier for the proposal record.",
      "pattern": "^[a-z0-9_-]+$",
      "minLength": 1
    },
    "title": {
      "type": "string",
      "description": "Short human-readable title of the proposal.",
      "minLength": 1
    },
    "proposal_type": {
      "type": "string",
      "description": "Primary proposal category.",
      "enum": [
        "add",
        "upgrade",
        "downgrade",
        "remove",
        "appeal",
        "rereview",
        "correction",
        "other"
      ]
    },
    "entity_ids": {
      "type": "array",
      "description": "List of related entity identifiers referenced by this proposal.",
      "minItems": 1,
      "items": {
        "type": "string",
        "minLength": 1
      }
    },
    "evidence_ids": {
      "type": "array",
      "description": "Optional list of related evidence identifiers supporting this proposal.",
      "default": [],
      "items": {
        "type": "string",
        "minLength": 1
      }
    },
    "current_status": {
      "type": "string",
      "description": "Current status of the related entity or entities when the proposal is created.",
      "enum": [
        "watchlist",
        "restricted",
        "blocked"
      ]
    },
    "proposed_status": {
      "type": "string",
      "description": "Target status proposed for the related entity or entities, when applicable.",
      "enum": [
        "watchlist",
        "restricted",
        "blocked"
      ]
    },
    "summary": {
      "type": "string",
      "description": "Short summary of the proposal objective and supporting grounds."
    },
    "rationale": {
      "type": "string",
      "description": "Longer explanation of the proposal rationale."
    },
    "created_at": {
      "type": "string",
      "description": "Timestamp when the proposal record was created.",
      "format": "date-time"
    },
    "updated_at": {
      "type": "string",
      "description": "Timestamp when the proposal record was last updated.",
      "format": "date-time"
    },
    "review_status": {
      "type": "string",
      "description": "Current review stage of the proposal.",
      "enum": [
        "unreviewed",
        "under_review",
        "eligible_for_vote",
        "decided",
        "closed"
      ],
      "default": "unreviewed"
    },
    "decision": {
      "type": "string",
      "description": "Current or final decision associated with the proposal.",
      "enum": [
        "pending",
        "accepted",
        "rejected",
        "maintained",
        "removed",
        "corrected",
        "other"
      ],
      "default": "pending"
    },
    "source_type": {
      "type": "string",
      "description": "Optional lightweight source label describing how the proposal entered the governance process."
    },
    "submitted_by": {
      "type": "string",
      "description": "Optional lightweight submitter label or identifier."
    },
    "notes": {
      "type": "string",
      "description": "Optional freeform notes about the proposal."
    },
    "related_proposal_ids": {
      "type": "array",
      "description": "Optional list of related proposal identifiers.",
      "default": [],
      "items": {
        "type": "string",
        "minLength": 1
      }
    },
    "decision_reason": {
      "type": "string",
      "description": "Optional short explanation of the current or final decision."
    }
  },
  "required": [
    "id",
    "title",
    "proposal_type",
    "entity_ids",
    "created_at",
    "updated_at"
  ]
}
