[
  {
    "id": "proposal_add_brightpeak_watchlist_record_001",
    "title": "Add BrightPeak Review Network as a watchlist entity record",
    "proposal_type": "add",
    "entity_ids": [
      "brightpeak_review_network"
    ],
    "evidence_ids": [
      "evidence_brightpeak_review_network_observation_001"
    ],
    "proposed_status": "watchlist",
    "summary": "This sample proposal requests formal inclusion of BrightPeak Review Network in the watchlist set based on a fictional record of coordinated review spam and synthetic expert positioning.",
    "rationale": "The supporting evidence suggests a repeated and organized pattern across multiple related domains. In this sample governance scenario, the record is sufficient for early inclusion and continued review, but is kept at the watchlist level pending further corroboration.",
    "created_at": "2026-03-18T10:00:00Z",
    "updated_at": "2026-03-18T10:05:00Z",
    "review_status": "under_review",
    "decision": "pending",
    "source_type": "community_submission",
    "submitted_by": "demo_reviewer_alpha",
    "notes": "This is a fictional example showing how a new watchlist record could be proposed from a public evidence trail.",
    "related_proposal_ids": [],
    "decision_reason": "Pending community review of whether the current fictional record is sufficient for watchlist inclusion."
  },
  {
    "id": "proposal_upgrade_novastride_to_restricted_001",
    "title": "Upgrade NovaStride Running Lab from watchlist to restricted",
    "proposal_type": "upgrade",
    "entity_ids": [
      "novastride_running_lab"
    ],
    "evidence_ids": [
      "evidence_novastride_comparison_pages_001"
    ],
    "current_status": "watchlist",
    "proposed_status": "restricted",
    "summary": "This sample proposal recommends upgrading NovaStride Running Lab from watchlist to restricted due to a stronger fictional record of repeated comparison-page placement patterns.",
    "rationale": "The evidence indicates that the observed placement pattern is not isolated and appears across related fictional properties with similar structure and language. In this sample workflow, that makes the record suitable for restricted treatment rather than continued watch-only status.",
    "created_at": "2026-03-18T10:20:00Z",
    "updated_at": "2026-03-18T10:25:00Z",
    "review_status": "eligible_for_vote",
    "decision": "pending",
    "source_type": "review_escalation",
    "submitted_by": "demo_registry_editor",
    "notes": "This example links the existing watchlist entity to a simple status-upgrade workflow.",
    "related_proposal_ids": [
      "proposal_add_brightpeak_watchlist_record_001"
    ],
    "decision_reason": "The proposal is ready for vote once the linked fictional evidence record is accepted as sufficient for escalation."
  }
]